{
  "captured_at": "2026-07-16T00:00:00Z",
  "corpus_id": "PLATFORM-PACK-Clearstra-refusal-option",
  "license": "MIT",
  "license_evidence_sha256": "ece849bde6e6b11ab5081c2c4796a24ce89d41f6f6674ebc713e37540e18e30d",
  "locator": "Clearstra/refusal-option",
  "origin_kind": "helix_generated",
  "restrictions": [
    "local_platform_pack_snapshot"
  ],
  "revision": "62957dc4fc2e52b887652ad853888a4d65c25d94",
  "schema": "helix-parity-source-lock/1.0",
  "source_id": "source:Clearstra:refusal-option",
  "source_sha256": "60c1a270ac4e598eadb1a675c32c6ab51a1394f94c3e701100f94593ac6e396e"
}
