{
  "captured_at": "2026-07-16T00:00:00Z",
  "corpus_id": "PLATFORM-PACK-Routestra-season-battery",
  "license": "MIT",
  "license_evidence_sha256": "ece849bde6e6b11ab5081c2c4796a24ce89d41f6f6674ebc713e37540e18e30d",
  "locator": "Routestra/season-battery",
  "origin_kind": "helix_generated",
  "restrictions": [
    "local_platform_pack_snapshot"
  ],
  "revision": "62957dc4fc2e52b887652ad853888a4d65c25d94",
  "schema": "helix-parity-source-lock/1.0",
  "source_id": "source:Routestra:season-battery",
  "source_sha256": "cd855c8b2b18156c2a9eab486db46c8b0c9fa2dbfbab19c286abcbde10b0ed34"
}
