{
  "captured_at": "2026-07-16T00:00:00Z",
  "corpus_id": "PLATFORM-PACK-Routestra-climate-resilience",
  "license": "MIT",
  "license_evidence_sha256": "ece849bde6e6b11ab5081c2c4796a24ce89d41f6f6674ebc713e37540e18e30d",
  "locator": "Routestra/climate-resilience",
  "origin_kind": "helix_generated",
  "restrictions": [
    "local_platform_pack_snapshot"
  ],
  "revision": "62957dc4fc2e52b887652ad853888a4d65c25d94",
  "schema": "helix-parity-source-lock/1.0",
  "source_id": "source:Routestra:climate-resilience",
  "source_sha256": "eb0c1625ca47f1b37c8a19647bfa7b01a3a7e5c89b66fdd46194c8ffe180325d"
}
