{
  "captured_at": "2026-07-16T00:00:00Z",
  "corpus_id": "PLATFORM-PACK-Clearstra-mineral-shock",
  "license": "MIT",
  "license_evidence_sha256": "ece849bde6e6b11ab5081c2c4796a24ce89d41f6f6674ebc713e37540e18e30d",
  "locator": "Clearstra/mineral-shock",
  "origin_kind": "helix_generated",
  "restrictions": [
    "local_platform_pack_snapshot"
  ],
  "revision": "62957dc4fc2e52b887652ad853888a4d65c25d94",
  "schema": "helix-parity-source-lock/1.0",
  "source_id": "source:Clearstra:mineral-shock",
  "source_sha256": "10f151c8c4e0e407b59ef599ada24f0684d5596a8bb72a3c1136f133828189e7"
}
