{
  "captured_at": "2026-07-16T00:00:00Z",
  "corpus_id": "PLATFORM-PACK-Certstra-cert-mesh",
  "license": "MIT",
  "license_evidence_sha256": "ece849bde6e6b11ab5081c2c4796a24ce89d41f6f6674ebc713e37540e18e30d",
  "locator": "Certstra/cert-mesh",
  "origin_kind": "helix_generated",
  "restrictions": [
    "local_platform_pack_snapshot"
  ],
  "revision": "62957dc4fc2e52b887652ad853888a4d65c25d94",
  "schema": "helix-parity-source-lock/1.0",
  "source_id": "source:Certstra:cert-mesh",
  "source_sha256": "319f438884301e339d0535632d3bab1aeeb922ff3669f48ed99e2f2baf5a934b"
}
