{
  "captured_at": "2026-07-16T00:00:00Z",
  "corpus_id": "PLATFORM-PACK-Attestra-pqc-mesh",
  "license": "MIT",
  "license_evidence_sha256": "ece849bde6e6b11ab5081c2c4796a24ce89d41f6f6674ebc713e37540e18e30d",
  "locator": "Attestra/pqc-mesh",
  "origin_kind": "helix_generated",
  "restrictions": [
    "local_platform_pack_snapshot"
  ],
  "revision": "5f0642566ef7df2649f0e661ed62fbfaee421dd5",
  "schema": "helix-parity-source-lock/1.0",
  "source_id": "source:Attestra:pqc-mesh",
  "source_sha256": "b74b0f8e4a80f9e1a153106ac35f97b6457115af10c67a672d6acaa75d9da8fc"
}
