{
  "captured_at": "2026-07-16T00:00:00Z",
  "corpus_id": "HC-PILOT-HELIX-004",
  "license": "MIT",
  "license_evidence_sha256": "64f450225d9190a102e0eca0e4a38b3131b50ceae256a484f1b537bd36f64c1c",
  "locator": "BioClock",
  "origin_kind": "helix_generated",
  "restrictions": [
    "snapshot_only",
    "raw_checkout_not_admitted",
    "safety_claim_scoped_to_evidence_package"
  ],
  "revision": "72aec836300f44689186afa4384345b74a589830",
  "schema": "helix-parity-source-lock/1.0",
  "source_id": "source:HC-PILOT-HELIX-004",
  "source_sha256": "1fc28487527f96e868419ba61e9be03caec5bd8fea61bda57a63244dcce176b9"
}
