{
  "captured_at": "2026-07-16T00:00:00Z",
  "corpus_id": "PLATFORM-PACK-Attestra-afferent-core",
  "license": "MIT",
  "license_evidence_sha256": "ece849bde6e6b11ab5081c2c4796a24ce89d41f6f6674ebc713e37540e18e30d",
  "locator": "Attestra/afferent-core",
  "origin_kind": "helix_generated",
  "restrictions": [
    "local_platform_pack_snapshot"
  ],
  "revision": "801ca1bc4562cf8a03bbfbea379f94e378b946aa",
  "schema": "helix-parity-source-lock/1.0",
  "source_id": "source:Attestra:afferent-core",
  "source_sha256": "efb8ef14bcae5b8c718fd6cc7dbff2db879f193293d0bb10dbaf95bdbbc08993"
}
